[
  {
    "id": "oglas_import_1",
    "naslov": "Senior Java Backend Developer",
    "opis": "Tražimo iskusnog inženjera za rad na mikroservisnoj arhitekturi i bazama podataka.",
    "plata": 2500.0,
    "agencijaId": "placeholder_agencija",
    "zahtevaneVestine": [
      {
        "vestina": { "id": "vestina_java" },
        "nivo": "NAPREDNI",
        "prioritet": "VISOK"
      },
      {
        "vestina": { "id": "vestina_baze" },
        "nivo": "SREDNJI",
        "prioritet": "NIZAK"
      }
    ]
  },
  {
    "id": "oglas_import_2",
    "naslov": "Frontend React Developer",
    "opis": "Potreban kreativan developer za izradu modernih korisničkih interfejsa.",
    "plata": 1800.0,
    "agencijaId": "placeholder_agencija",
    "zahtevaneVestine": [
      {
        "vestina": { "id": "vestina_react" },
        "nivo": "NAPREDNI",
        "prioritet": "VISOK"
      },
      {
        "vestina": { "id": "vestina_uiux" },
        "nivo": "SREDNJI",
        "prioritet": "NIZAK"
      }
    ]
  },
  {
    "id": "oglas_import_3",
    "naslov": "Full-Stack Web Inženjer",
    "opis": "Pridruži se našem timu i radi na end-to-end razvoju web aplikacija.",
    "plata": 2200.0,
    "agencijaId": "placeholder_agencija",
    "zahtevaneVestine": [
      {
        "vestina": { "id": "vestina_react" },
        "nivo": "SREDNJI",
        "prioritet": "VISOK"
      },
      {
        "vestina": { "id": "vestina_java" },
        "nivo": "SREDNJI",
        "prioritet": "VISOK"
      }
    ]
  },
  {
    "id": "oglas_import_4",
    "naslov": "Sistem Administrator / DevOps",
    "opis": "Održavanje servera, mrežne infrastrukture i sigurnosnih protokola.",
    "plata": 1900.0,
    "agencijaId": "placeholder_agencija",
    "zahtevaneVestine": [
      {
        "vestina": { "id": "vestina_os" },
        "nivo": "NAPREDNI",
        "prioritet": "VISOK"
      },
      {
        "vestina": { "id": "vestina_mreze" },
        "nivo": "NAPREDNI",
        "prioritet": "VISOK"
      }
    ]
  },
  {
    "id": "oglas_import_5",
    "naslov": "Junior AI / Machine Learning Inženjer",
    "opis": "Odlična prilika za početnike da rade na treniranju modela i analizi podataka.",
    "plata": 1200.0,
    "agencijaId": "placeholder_agencija",
    "zahtevaneVestine": [
      {
        "vestina": { "id": "vestina_python" },
        "nivo": "SREDNJI",
        "prioritet": "VISOK"
      },
      {
        "vestina": { "id": "vestina_ml" },
        "nivo": "POCETNI",
        "prioritet": "NIZAK"
      }
    ]
  }
]